id,name,tagline,first_brewed,description,image_url,abv,ibu,target_fg,target_og,ebc,srm,ph,attenuation_level,volume,boil_volume,method,ingredients,food_pairing,brewers_tips,contributed_by
84,Baby Saison - B-Sides,Trial Baby Saison.,08/2015,A hark back to the origins of Saison; slight spice and earthy notes with highlights of lemon and pepper make a beer that could quench the thirst of any seasonal worker.,https://images.punkapi.com/v2/keg.png,3.6,9.0,1004.0,1032.0,2.0,1.0,4.4,88.0,"{'value': 20, 'unit': 'litres'}","{'value': 25, 'unit': 'litres'}","{'mash_temp': [{'temp': {'value': 60, 'unit': 'celsius'}, 'duration': 10}, {'temp': {'value': 65, 'unit': 'celsius'}, 'duration': 30}, {'temp': {'value': 72, 'unit': 'celsius'}, 'duration': 10}, {'temp': {'value': 78, 'unit': 'celsius'}, 'duration': 5}], 'fermentation': {'temp': {'value': 21, 'unit': 'celsius'}}, 'twist': None}","{'malt': [{'name': 'Pilsner', 'amount': {'value': 5.4, 'unit': 'kilograms'}}, {'name': 'Munich', 'amount': {'value': 0.13, 'unit': 'kilograms'}}, {'name': 'Amber', 'amount': {'value': 0.05, 'unit': 'kilograms'}}], 'hops': [{'name': 'Sorachi Ace', 'amount': {'value': 6.5, 'unit': 'grams'}, 'add': 'start', 'attribute': 'bitter'}, {'name': 'Sorachi Ace', 'amount': {'value': 6.5, 'unit': 'grams'}, 'add': 'end', 'attribute': 'flavour'}, {'name': 'Mosaic', 'amount': {'value': 6.5, 'unit': 'grams'}, 'add': 'end', 'attribute': 'flavour'}, {'name': 'Amarillo', 'amount': {'value': 6.5, 'unit': 'grams'}, 'add': 'end', 'attribute': 'flavour'}], 'yeast': 'Wyeast 3711 - French Saison™'}","['Pork chop with rosemary chips', 'Steak tartare', 'Belgian waffles']",Ferment between 21 and 24°C to get this saison as dry as possible.,Matt Ball <GeordieMatt>
85,Santa Paws,Christmas Scoth Ale.,10/2010,"A 4.5% decadent scotch ale brewed with Scottish heather honey. A robust malty beer packed with flavour, at a strength you can drink all (Christmas) day long. Santa Paws is our antidote to the chaos of the festive season. All the flavours of Christmas pudding in liquid form.",https://images.punkapi.com/v2/85.png,4.5,35.0,1013.0,1048.0,44.0,22.0,4.4,72.9,"{'value': 20, 'unit': 'litres'}","{'value': 25, 'unit': 'litres'}","{'mash_temp': [{'temp': {'value': 66, 'unit': 'celsius'}, 'duration': 75}], 'fermentation': {'temp': {'value': 19, 'unit': 'celsius'}}, 'twist': None}","{'malt': [{'name': 'Extra Pale', 'amount': {'value': 1.75, 'unit': 'kilograms'}}, {'name': 'Munich', 'amount': {'value': 0.44, 'unit': 'kilograms'}}, {'name': 'Dark Crystal', 'amount': {'value': 0.5, 'unit': 'kilograms'}}, {'name': 'Wheat', 'amount': {'value': 0.56, 'unit': 'kilograms'}}, {'name': 'Flaked Oats', 'amount': {'value': 0.56, 'unit': 'kilograms'}}, {'name': 'Carafa Special Malt Type 3', 'amount': {'value': 0.13, 'unit': 'kilograms'}}, {'name': 'Amber', 'amount': {'value': 0.25, 'unit': 'kilograms'}}, {'name': 'Weyermann Beech Smoked', 'amount': {'value': 0.63, 'unit': 'kilograms'}}], 'hops': [{'name': 'First Gold', 'amount': {'value': 18.5, 'unit': 'grams'}, 'add': 'start', 'attribute': 'bitter'}, {'name': 'Willamette', 'amount': {'value': 12.5, 'unit': 'grams'}, 'add': 'start', 'attribute': 'bitter'}, {'name': 'Hallertauer Mittelfrüh', 'amount': {'value': 6.5, 'unit': 'grams'}, 'add': 'start', 'attribute': 'bitter'}], 'yeast': 'Wyeast 1056 - American Ale™'}","['French onion soup', 'Braised pheasant', 'Caramel sauce and hot fudge']",The addition of Weyermann Beech Smoked malt creates a beer with a delicate smoke character.,Sam Mason <samjbmason>
86,Original Dogma (Née Speedball),Strong Ale With Honey And Spices.,07/2008,"A strong ale, brewed with guarana, Californian poppy, kola nut and Scottish heather honey. A conspiracy of trans-continental ingredients infused with some devastatingly BrewDog imaginative thinking.",https://images.punkapi.com/v2/86.png,7.8,60.0,1012.0,1071.3,31.0,15.5,4.3,83.2,"{'value': 20, 'unit': 'litres'}","{'value': 25, 'unit': 'litres'}","{'mash_temp': [{'temp': {'value': 64, 'unit': 'celsius'}, 'duration': 75}], 'fermentation': {'temp': {'value': 21, 'unit': 'celsius'}}, 'twist': 'Herb and honey addition'}","{'malt': [{'name': 'Extra Pale', 'amount': {'value': 4.5, 'unit': 'kilograms'}}, {'name': 'Munich', 'amount': {'value': 0.5, 'unit': 'kilograms'}}, {'name': 'Amber', 'amount': {'value': 0.05, 'unit': 'kilograms'}}, {'name': 'Dark Crystal', 'amount': {'value': 0.08, 'unit': 'kilograms'}}], 'hops': [{'name': 'Amarillo', 'amount': {'value': 30, 'unit': 'grams'}, 'add': 'start', 'attribute': 'bitter'}, {'name': 'Amarillo', 'amount': {'value': 10, 'unit': 'grams'}, 'add': 'end', 'attribute': 'flavour'}, {'name': 'Bobek', 'amount': {'value': 10, 'unit': 'grams'}, 'add': 'end', 'attribute': 'flavour'}, {'name': 'Guarana Powder', 'amount': {'value': 6, 'unit': 'grams'}, 'add': 'end', 'attribute': 'flavour'}, {'name': 'Kola Nut Powder', 'amount': {'value': 6, 'unit': 'grams'}, 'add': 'end', 'attribute': 'flavour'}, {'name': 'Poppy Seed', 'amount': {'value': 6, 'unit': 'grams'}, 'add': 'end', 'attribute': 'flavour'}, {'name': 'Heather Honey', 'amount': {'value': 100, 'unit': 'grams'}, 'add': 'end', 'attribute': 'flavour'}], 'yeast': 'Safale US-05'}","['Spicy seafood stew', 'French onion soup', 'Mexican wedding cake (cookies)']","Get really good quality heather honey, the more aromatic the better. Honey is 100% fermentable, but it does have a huge influence on the ester profile of the beer – in this case high floral esters.",Sam Mason <samjbmason>
87,Alpha Pop,Hoppy Rye Pale Ale.,03/2014,"A hoppy Rye Ale loaded with an avalanche of citrus and resinous flavours. Columbus, our high-alpha friend, lends a huge pithy citrus blast, with Ahtanum providing a punchy tropical fruit back-up. Brewing with rye adds a spiciness to the speciality malt caramel backbone, giving a warm ginger snap flavour, before slowly the hops, barley and rye combine and build to an orangey, biscuity, almost chocolatey crescendo.",https://images.punkapi.com/v2/87.png,4.5,30.0,1011.0,1045.0,25.0,12.5,4.4,75.6,"{'value': 20, 'unit': 'litres'}","{'value': 25, 'unit': 'litres'}","{'mash_temp': [{'temp': {'value': 65, 'unit': 'celsius'}, 'duration': None}], 'fermentation': {'temp': {'value': 19, 'unit': 'celsius'}}, 'twist': None}","{'malt': [{'name': 'Extra Pale', 'amount': {'value': 3.69, 'unit': 'kilograms'}}, {'name': 'Caramalt', 'amount': {'value': 0.16, 'unit': 'kilograms'}}, {'name': 'Dark Crystal', 'amount': {'value': 0.06, 'unit': 'kilograms'}}, {'name': 'Rye', 'amount': {'value': 0.31, 'unit': 'kilograms'}}], 'hops': [{'name': 'Columbus', 'amount': {'value': 5, 'unit': 'grams'}, 'add': 'start', 'attribute': 'bitter'}, {'name': 'Columbus', 'amount': {'value': 7.5, 'unit': 'grams'}, 'add': 'middle', 'attribute': 'flavour'}, {'name': 'Ahtanum', 'amount': {'value': 12.5, 'unit': 'grams'}, 'add': 'middle', 'attribute': 'flavour'}, {'name': 'Ahtanum', 'amount': {'value': 37.5, 'unit': 'grams'}, 'add': 'end', 'attribute': 'flavour'}, {'name': 'Ahtanum', 'amount': {'value': 125, 'unit': 'grams'}, 'add': 'dry hop', 'attribute': 'aroma'}, {'name': 'Columbus', 'amount': {'value': 125, 'unit': 'grams'}, 'add': 'dry hop', 'attribute': 'aroma'}], 'yeast': 'Wyeast 1056 - American Ale™'}","['Spicy lamb tikka masala', 'Spicy beef and Mexican black bean burger', 'Poached cinnamon apple muffins']",Columbus and Ahtanum hop additions create a perfect blend of resin and lemon character.,Sam Mason <samjbmason>
88,Bavarian Weizen,Unleash the Yeast Series.,09/2013,"Our Unleash the Yeast series was an epic experiment into the differences in aroma and flavour provided by switching up your yeast. We brewed up a wort with a light caramel note and some toasty biscuit flavour, and hopped it with Amarillo and Centennial for a citrusy bitterness. Everything else is down to the yeast. Bavarian Weizen yeast adds traditional weissbier notes of banana and clove.",https://images.punkapi.com/v2/88.png,6.3,55.0,1012.0,1060.0,30.0,15.0,4.4,80.0,"{'value': 20, 'unit': 'litres'}","{'value': 25, 'unit': 'litres'}","{'mash_temp': [{'temp': {'value': 65, 'unit': 'celsius'}, 'duration': None}], 'fermentation': {'temp': {'value': 22, 'unit': 'celsius'}}, 'twist': None}","{'malt': [{'name': 'Extra Pale', 'amount': {'value': 4.58, 'unit': 'kilograms'}}, {'name': 'Caramalt', 'amount': {'value': 0.25, 'unit': 'kilograms'}}, {'name': 'Dark Crystal', 'amount': {'value': 0.06, 'unit': 'kilograms'}}, {'name': 'Munich', 'amount': {'value': 0.25, 'unit': 'kilograms'}}], 'hops': [{'name': 'Centennial', 'amount': {'value': 5, 'unit': 'grams'}, 'add': 'start', 'attribute': 'bitter'}, {'name': 'Amarillo', 'amount': {'value': 5, 'unit': 'grams'}, 'add': 'start', 'attribute': 'bitter'}, {'name': 'Centennial', 'amount': {'value': 10, 'unit': 'grams'}, 'add': 'middle', 'attribute': 'flavour'}, {'name': 'Amarillo', 'amount': {'value': 10, 'unit': 'grams'}, 'add': 'middle', 'attribute': 'flavour'}, {'name': 'Centennial', 'amount': {'value': 17.5, 'unit': 'grams'}, 'add': 'end', 'attribute': 'flavour'}, {'name': 'Amarillo', 'amount': {'value': 17.5, 'unit': 'grams'}, 'add': 'end', 'attribute': 'flavour'}], 'yeast': 'WLP351 - Bavarian Weizen'}","['Spicy paella', 'German bratwurst with spicy mustard dip and vinaigrette salad', 'Creamy eggs benedict']",Play around with the fermentation temperature to get the best flavour profile from the individual yeasts.,Ali Skinner <AliSkinner>
89,Citra,Single Hop IPA Series – 2011.,01/2011,"The Pacific North West of America is home to the Citra hop. America is not just about cheer leaders, a silly version of football, elastic top jeans and cheeseburgers. They grow remarkable hops and Citra is a killer example of this, embodying all that is good about American hops and then some. Fearfully hard to resist, this beer is loaded with brash citrus, grapefruit, orange, hints of resinous pine and touches of blackcurrant. Devilishly moreish.",https://images.punkapi.com/v2/89.png,7.5,70.0,1013.0,1068.0,30.0,15.0,4.4,82.1,"{'value': 20, 'unit': 'litres'}","{'value': 25, 'unit': 'litres'}","{'mash_temp': [{'temp': {'value': 65, 'unit': 'celsius'}, 'duration': None}], 'fermentation': {'temp': {'value': 19, 'unit': 'celsius'}}, 'twist': None}","{'malt': [{'name': 'Extra Pale', 'amount': {'value': 6.38, 'unit': 'kilograms'}}, {'name': 'Crystal 150', 'amount': {'value': 0.13, 'unit': 'kilograms'}}, {'name': 'Caramalt', 'amount': {'value': 0.25, 'unit': 'kilograms'}}], 'hops': [{'name': 'Citra', 'amount': {'value': 2.5, 'unit': 'grams'}, 'add': 'start', 'attribute': 'bitter'}, {'name': 'Citra', 'amount': {'value': 10, 'unit': 'grams'}, 'add': 'middle', 'attribute': 'flavour'}, {'name': 'Citra', 'amount': {'value': 37.5, 'unit': 'grams'}, 'add': 'end', 'attribute': 'flavour'}], 'yeast': 'Wyeast 1056 - American Ale™'}","['Lemon and herb salmon', 'Sharp cheddar with mango chutney', 'Shredded chicken tacos with pico de gallo']",Another hop to be treated with respect. Too much in the kettle or dry hop will turn the beer into a garlicky disaster.,Sam Mason <samjbmason>
90,#Mashtag 2015,US Hopped Black Barley Wine.,05/2015,"Democratically voted on by you and the BrewDog beer community. A wonderfully burnt toast malt backbone, loaded with American Hops for floral, citrus flavours and warm boozy vanilla and toasted oak.",https://images.punkapi.com/v2/90.png,10.0,85.0,1020.0,1098.0,130.0,65.0,4.4,79.6,"{'value': 20, 'unit': 'litres'}","{'value': 25, 'unit': 'litres'}","{'mash_temp': [{'temp': {'value': 65, 'unit': 'celsius'}, 'duration': 75}], 'fermentation': {'temp': {'value': 21, 'unit': 'celsius'}}, 'twist': 'Oak Chips: 38.5g at FV, Vanilla Pods at FV'}","{'malt': [{'name': 'Pale Ale', 'amount': {'value': 6.35, 'unit': 'kilograms'}}, {'name': 'Munich', 'amount': {'value': 0.77, 'unit': 'kilograms'}}, {'name': 'Caramalt', 'amount': {'value': 0.96, 'unit': 'kilograms'}}, {'name': 'Special W', 'amount': {'value': 0.29, 'unit': 'kilograms'}}, {'name': 'Carafa Special Malt Type 1', 'amount': {'value': 0.38, 'unit': 'kilograms'}}, {'name': 'Carafa Special Malt Type 3', 'amount': {'value': 0.19, 'unit': 'kilograms'}}], 'hops': [{'name': 'Nugget', 'amount': {'value': 19, 'unit': 'grams'}, 'add': 'start', 'attribute': 'bitter'}, {'name': 'Columbus', 'amount': {'value': 38.5, 'unit': 'grams'}, 'add': 'start', 'attribute': 'bitter'}, {'name': 'Centennial', 'amount': {'value': 19, 'unit': 'grams'}, 'add': 'middle', 'attribute': 'flavour'}, {'name': 'Simcoe', 'amount': {'value': 19, 'unit': 'grams'}, 'add': 'middle', 'attribute': 'flavour'}, {'name': 'Centennial', 'amount': {'value': 19, 'unit': 'grams'}, 'add': 'end', 'attribute': 'flavour'}, {'name': 'Simcoe', 'amount': {'value': 19, 'unit': 'grams'}, 'add': 'end', 'attribute': 'flavour'}, {'name': 'Willamette', 'amount': {'value': 19, 'unit': 'grams'}, 'add': 'end', 'attribute': 'flavour'}, {'name': 'Centennial', 'amount': {'value': 38.5, 'unit': 'grams'}, 'add': 'dry hop', 'attribute': 'aroma'}, {'name': 'Simcoe', 'amount': {'value': 38.5, 'unit': 'grams'}, 'add': 'dry hop', 'attribute': 'aroma'}, {'name': 'Willamette', 'amount': {'value': 38.5, 'unit': 'grams'}, 'add': 'dry hop', 'attribute': 'aroma'}], 'yeast': 'Wyeast 1272 - American Ale II™'}","['Charcuterie platter (featuring Italian salami)', 'Blue cheese wedge salad', 'Rich dark chocolate volcano cake']",Steep the oak chips and vanilla in separate bags in the cold conditioning phase. Taste every 2 - 3 days and as soon as profile is desirable they can be removed easily.,Sam Mason <samjbmason>
91,Dead Pony Club,West Coast Kicks. Citrusy. Zesty. Bright.,03/2012,"Our California style West Coast IPA has light toffee and caramel notes layered on biscuit malt, supporting a huge, fresh citrus aroma, with lemongrass, lime zest, grapefruit peel, alongside some tropical notes, courtesy of some heavy-hitting US hops.",https://images.punkapi.com/v2/91.png,3.8,35.0,1012.0,1040.0,25.0,12.7,4.4,70.0,"{'value': 20, 'unit': 'litres'}","{'value': 25, 'unit': 'litres'}","{'mash_temp': [{'temp': {'value': 62, 'unit': 'celsius'}, 'duration': 75}], 'fermentation': {'temp': {'value': 19, 'unit': 'celsius'}}, 'twist': None}","{'malt': [{'name': 'Extra Pale', 'amount': {'value': 2.79, 'unit': 'kilograms'}}, {'name': 'Caramalt', 'amount': {'value': 0.63, 'unit': 'kilograms'}}, {'name': 'Crystal 150', 'amount': {'value': 0.19, 'unit': 'kilograms'}}], 'hops': [{'name': 'Simcoe', 'amount': {'value': 5, 'unit': 'grams'}, 'add': 'start', 'attribute': 'bitter'}, {'name': 'Citra', 'amount': {'value': 5, 'unit': 'grams'}, 'add': 'start', 'attribute': 'bitter'}, {'name': 'Simcoe', 'amount': {'value': 5, 'unit': 'grams'}, 'add': 'middle', 'attribute': 'flavour'}, {'name': 'Citra', 'amount': {'value': 5, 'unit': 'grams'}, 'add': 'middle', 'attribute': 'flavour'}, {'name': 'Simcoe', 'amount': {'value': 50, 'unit': 'grams'}, 'add': 'dry hop', 'attribute': 'aroma'}, {'name': 'Citra', 'amount': {'value': 75, 'unit': 'grams'}, 'add': 'dry hop', 'attribute': 'aroma'}, {'name': 'Mosaic', 'amount': {'value': 62.5, 'unit': 'grams'}, 'add': 'dry hop', 'attribute': 'aroma'}], 'yeast': 'Wyeast 1056 - American Ale™'}","['Baja style fish tacos', 'Jerk chicken', 'Apple crumble']","It may be tempting to throw extra (extra) hops at Dead Pony Club, but try adding a little at a time to consecutive brews rather than cramming in loads extra on your first time.",Sam Mason <samjbmason>
92,AB:09,Cranachan Imperial Stout.,11/2010,"This Cranachan Imperial Stout was inspired by the famous Scottish dessert, and brewed with a mountain of dark malts, loads of oats, Scottish heather honey and local raspberries. The beer was then transferred to oak casks to mature for 6 months.",https://images.punkapi.com/v2/92.png,11.6,77.0,1022.0,1110.0,265.0,132.5,5.2,80.0,"{'value': 20, 'unit': 'litres'}","{'value': 25, 'unit': 'litres'}","{'mash_temp': [{'temp': {'value': 65, 'unit': 'celsius'}, 'duration': 90}], 'fermentation': {'temp': {'value': 19, 'unit': 'celsius'}}, 'twist': 'Lactose: 125g, Scottish Heather Honey: 125g, Raspberries: 187.5g'}","{'malt': [{'name': 'Maris Otter Extra Pale', 'amount': {'value': 10, 'unit': 'kilograms'}}, {'name': 'Carafa Special Malt Type 1', 'amount': {'value': 1.88, 'unit': 'kilograms'}}, {'name': 'Flaked Oats', 'amount': {'value': 1.88, 'unit': 'kilograms'}}, {'name': 'Crystal 150', 'amount': {'value': 0.94, 'unit': 'kilograms'}}, {'name': 'Dark Crystal 350-400', 'amount': {'value': 0.94, 'unit': 'kilograms'}}], 'hops': [{'name': 'Fuggles', 'amount': {'value': 125, 'unit': 'grams'}, 'add': 'start', 'attribute': 'bitter'}, {'name': 'Fuggles', 'amount': {'value': 37.5, 'unit': 'grams'}, 'add': 'end', 'attribute': 'flavour'}], 'yeast': 'Champagne'}","['Aged cheddar with honey and raspberry chutney', 'Rich beef stew with winter vegetables and a dash of honey', 'Scottish raspberry cranachan parfait']",Lactose - or milk sugar - is un-fermentable. It adds a creamy mouthfeel to the beer. Experiment by using different types of honey for altered flavour profiles.,Sam Mason <samjbmason>
93,Mango Gose - B-Sides,Hoppy Mango Gose.,07/2015,"Kettle soured hoppy mango gose. A delicate balance of sweet, juicy mango, sour lime and salinity.",https://images.punkapi.com/v2/keg.png,6.4,40.0,1000.0,1057.0,10.0,5.0,3.5,87.0,"{'value': 20, 'unit': 'litres'}","{'value': 25, 'unit': 'litres'}","{'mash_temp': [{'temp': {'value': 60, 'unit': 'celsius'}, 'duration': 10}, {'temp': {'value': 65, 'unit': 'celsius'}, 'duration': 30}, {'temp': {'value': 72, 'unit': 'celsius'}, 'duration': 10}, {'temp': {'value': 78, 'unit': 'celsius'}, 'duration': 5}], 'fermentation': {'temp': {'value': 20, 'unit': 'celsius'}}, 'twist': 'Kettle Soured, 5 Mangoes pureed at FV'}","{'malt': [{'name': 'Extra Pale', 'amount': {'value': 5.25, 'unit': 'kilograms'}}, {'name': 'Wheat Malt', 'amount': {'value': 1.88, 'unit': 'kilograms'}}, {'name': 'Dark Crystal', 'amount': {'value': 0.13, 'unit': 'kilograms'}}], 'hops': [{'name': 'Sorachi Ace', 'amount': {'value': 7.5, 'unit': 'grams'}, 'add': 'start', 'attribute': 'bitter'}, {'name': 'Amarillo', 'amount': {'value': 7.5, 'unit': 'grams'}, 'add': 'start', 'attribute': 'bitter'}, {'name': 'Sorachi Ace', 'amount': {'value': 15, 'unit': 'grams'}, 'add': 'end', 'attribute': 'flavour'}, {'name': 'Amarillo', 'amount': {'value': 15, 'unit': 'grams'}, 'add': 'end', 'attribute': 'flavour'}], 'yeast': 'Wyeast 1056 - American Ale™'}","['Okra fries', 'Sea bass ceviche', 'Sea salt fudge']","Try to use the juiciest, ripest mangoes possible.",Sam Mason <samjbmason>
94,Everday Anarchy,White Wine Barrel-Aged Imperial Red Saison.,06/2013,"This French white wine barrel aged Imperial Saison has a plethora of intertwining flavours. Huge aromas of peach, syrup, tangerine, sherry, toffee and raisin, followed by a dynamic bracing acidity.",https://images.punkapi.com/v2/94.png,10.5,45.0,1005.0,1081.0,15.0,7.5,4.4,93.8,"{'value': 20, 'unit': 'litres'}","{'value': 25, 'unit': 'litres'}","{'mash_temp': [{'temp': {'value': 65, 'unit': 'celsius'}, 'duration': 75}], 'fermentation': {'temp': {'value': 23, 'unit': 'celsius'}}, 'twist': 'Coriander seeds: 12.5g at End (WP), Orange: 25g at End (WP), Lemon: 25g at End (WP), Honey: 125g at End (WP), Pink Peppercorns: 3.5g at End (WP)'}","{'malt': [{'name': 'Extra Pale', 'amount': {'value': 6.13, 'unit': 'kilograms'}}, {'name': 'Caramalt', 'amount': {'value': 0.38, 'unit': 'kilograms'}}, {'name': 'Wheat', 'amount': {'value': 0.25, 'unit': 'kilograms'}}, {'name': 'Rye', 'amount': {'value': 0.25, 'unit': 'kilograms'}}], 'hops': [{'name': 'Motueka', 'amount': {'value': 25, 'unit': 'grams'}, 'add': 'start', 'attribute': 'bitter'}, {'name': 'Saaz', 'amount': {'value': 12.5, 'unit': 'grams'}, 'add': 'middle', 'attribute': 'flavour'}, {'name': 'Bobek', 'amount': {'value': 12.5, 'unit': 'grams'}, 'add': 'middle', 'attribute': 'flavour'}, {'name': 'Saaz', 'amount': {'value': 12.5, 'unit': 'grams'}, 'add': 'end', 'attribute': 'flavour'}, {'name': 'Bobek', 'amount': {'value': 12.5, 'unit': 'grams'}, 'add': 'end', 'attribute': 'flavour'}], 'yeast': 'Wyeast 3711 - French Saison™'}","['Spiced carrot and coriander soup', 'Spicy chilli king prawns', 'Orange zest tart']","The honey addition will help to dry out the beer, as the saison yeast will continue to ferment long after most ale yeast.",Sam Mason <samjbmason>
95,Peroxide Punk,Zesty Pale Ale.,04/2007,"A trashy blonde concession for those who felt that our original 6% Punk IPA recipe was too hard hitting. This was also the first time we experimented with dry hopping our beers, giving Peroxide Punk a depth of flavour that belies its modest ABV. Zesty, aromatic and thirst quenching.",https://images.punkapi.com/v2/keg.png,4.0,40.0,1009.0,1039.0,18.0,9.0,4.4,76.9,"{'value': 20, 'unit': 'litres'}","{'value': 25, 'unit': 'litres'}","{'mash_temp': [{'temp': {'value': 65, 'unit': 'celsius'}, 'duration': 75}], 'fermentation': {'temp': {'value': 19, 'unit': 'celsius'}}, 'twist': None}","{'malt': [{'name': 'Maris Otter', 'amount': {'value': 3.85, 'unit': 'kilograms'}}], 'hops': [{'name': 'Amarillo', 'amount': {'value': 25, 'unit': 'grams'}, 'add': 'start', 'attribute': 'bitter'}, {'name': 'Simcoe', 'amount': {'value': 20, 'unit': 'grams'}, 'add': 'end', 'attribute': 'flavour'}, {'name': 'Amarillo', 'amount': {'value': 25, 'unit': 'grams'}, 'add': 'end', 'attribute': 'flavour'}, {'name': 'Crystal', 'amount': {'value': 20, 'unit': 'grams'}, 'add': 'end', 'attribute': 'flavour'}, {'name': 'Liberty', 'amount': {'value': 20, 'unit': 'grams'}, 'add': 'end', 'attribute': 'flavour'}, {'name': 'Simcoe', 'amount': {'value': 50, 'unit': 'grams'}, 'add': 'dry hop', 'attribute': 'aroma'}, {'name': 'Amarillo', 'amount': {'value': 50, 'unit': 'grams'}, 'add': 'dry hop', 'attribute': 'aroma'}], 'yeast': 'Wyeast 1056 - American Ale™'}","['Sashimi', 'Pan roasted poussin with spring veg', 'Lemon and thyme panna cotta']","During the mashing process, try to mix the malt without 'turning' or splashing too much. This will cause more oxygen to be dissolved in the mash - and result in a beer that will taste a little like a cardboard box.",Sam Mason <samjbmason>
96,Lumberjack Stout,Blueberry Bacon Stout.,12/2013,"Lumberjack Stout is an intense beast that took its inspriation from what an actual bona-fide lumberjack might have for breakfast. Flavours of molasses, chocolate, smoke, berry, coffee and more, with a low bitterness, leaning this beer firmly towards the malty side.",https://images.punkapi.com/v2/keg.png,15.2,20.0,1020.0,1110.0,158.0,79.0,4.4,82.0,"{'value': 20, 'unit': 'litres'}","{'value': 25, 'unit': 'litres'}","{'mash_temp': [{'temp': {'value': 65, 'unit': 'celsius'}, 'duration': 105}], 'fermentation': {'temp': {'value': 21, 'unit': 'celsius'}}, 'twist': 'Blueberries, maple syrup and coffee, then aged in ex Grain whisky casks. Maple Syrup: 50g at end. Blueberries: 100g at middle.'}","{'malt': [{'name': 'Extra Pale', 'amount': {'value': 10.63, 'unit': 'kilograms'}}, {'name': 'Carafa Special Malt Type 3', 'amount': {'value': 1.25, 'unit': 'kilograms'}}, {'name': 'Flaked Oats', 'amount': {'value': 2.19, 'unit': 'kilograms'}}, {'name': 'Smoked Malt', 'amount': {'value': 0.63, 'unit': 'kilograms'}}, {'name': 'Crystal', 'amount': {'value': 1.25, 'unit': 'kilograms'}}], 'hops': [{'name': 'Galena', 'amount': {'value': 36, 'unit': 'grams'}, 'add': 'start', 'attribute': 'bitter'}, {'name': 'Willamette', 'amount': {'value': 37.5, 'unit': 'grams'}, 'add': 'end', 'attribute': 'flavour'}], 'yeast': 'Wyeast 1272 - American Ale II™'}","['Maple syrup drizzled chocolate chip pancakes', 'Fried bacon with crispy honeycomb bits', 'Coffee cake']",Adding extra smoked malt will amp up the bacon character.,Ali Skinner <AliSkinner>
97,Bowman's Beard - B-Sides,English Barley Wine.,03/2015,"Ice-distilled double barley wine brewed by Chris from Stone Brewing Co. (see Sunmaid Stout) and BrewDog's own brewers. As robust, resinous and badass as its eponymic beard.",https://images.punkapi.com/v2/keg.png,18.3,50.0,1011.0,1067.0,15.0,8.0,5.3,84.0,"{'value': 20, 'unit': 'litres'}","{'value': 25, 'unit': 'litres'}","{'mash_temp': [{'temp': {'value': 65, 'unit': 'celsius'}, 'duration': 90}], 'fermentation': {'temp': {'value': 19, 'unit': 'celsius'}}, 'twist': 'Ice-distilled after fermentation to get to 18.3%'}","{'malt': [{'name': 'Extra Pale', 'amount': {'value': 4.5, 'unit': 'kilograms'}}, {'name': 'Rye', 'amount': {'value': 0.5, 'unit': 'kilograms'}}, {'name': 'CaraAroma', 'amount': {'value': 0.04, 'unit': 'kilograms'}}, {'name': 'Caramunich', 'amount': {'value': 0.1, 'unit': 'kilograms'}}, {'name': 'Brown', 'amount': {'value': 0.25, 'unit': 'kilograms'}}, {'name': 'Caramalt', 'amount': {'value': 0.13, 'unit': 'kilograms'}}, {'name': 'Crystal', 'amount': {'value': 0.07, 'unit': 'kilograms'}}, {'name': 'Munich', 'amount': {'value': 0.11, 'unit': 'kilograms'}}], 'hops': [{'name': 'Motueka', 'amount': {'value': 10, 'unit': 'grams'}, 'add': 'start', 'attribute': 'bitter'}, {'name': 'First Gold', 'amount': {'value': 10, 'unit': 'grams'}, 'add': 'start', 'attribute': 'bitter'}, {'name': 'Galena', 'amount': {'value': 10, 'unit': 'grams'}, 'add': 'start', 'attribute': 'bitter'}, {'name': 'Motueka', 'amount': {'value': 5, 'unit': 'grams'}, 'add': 'end', 'attribute': 'flavour'}, {'name': 'First Gold', 'amount': {'value': 5, 'unit': 'grams'}, 'add': 'end', 'attribute': 'flavour'}, {'name': 'Galena', 'amount': {'value': 10, 'unit': 'grams'}, 'add': 'end', 'attribute': 'flavour'}], 'yeast': 'Wyeast 1056 - American Ale™ & Wyeast 1272 - American Ale II™'}","['Celery and stilton soup', 'Salted caramel soufflé']",Ferment first with the American ale strain and after a week add the American Ale II to really push up the ABV. Use a starter to get the yeast raring and ready to go before the second addition.,Sam Mason <samjbmason>
