id,name,tagline,first_brewed,description,image_url,abv,ibu,target_fg,target_og,ebc,srm,ph,attenuation_level,volume,boil_volume,method,ingredients,food_pairing,brewers_tips,contributed_by
229,Rye Hammer,Our Ruthless IPA with A Spicy Twist.,06/2016,"Rye Hammer is the fourth of our super-charged hyped up hybrids. A bready beery beast. Rye grains and American hops unite in an agricultural superpower. Aroma of roasted malts, rye bread and subtle floral hops. Grapefruit, roasted caramel with malty fruity notes, followed by the bitterest of bitter finishes. Rye Hammer – liquid daily bread.",https://images.punkapi.com/v2/229.png,7.2,250.0,1010.0,1065.0,17.0,8.5,4.4,84.6,"{'value': 20, 'unit': 'litres'}","{'value': 25, 'unit': 'litres'}","{'mash_temp': [{'temp': {'value': 65, 'unit': 'celsius'}, 'duration': 75}], 'fermentation': {'temp': {'value': 21, 'unit': 'celsius'}}, 'twist': None}","{'malt': [{'name': 'Extra Pale', 'amount': {'value': 5, 'unit': 'kilograms'}}, {'name': 'Rye', 'amount': {'value': 1, 'unit': 'kilograms'}}], 'hops': [{'name': 'Centennial', 'amount': {'value': 25, 'unit': 'grams'}, 'add': 'start', 'attribute': 'bitter'}, {'name': 'Columbus Extract', 'amount': {'value': 30, 'unit': 'grams'}, 'add': 'start', 'attribute': 'bitter'}, {'name': 'Centennial', 'amount': {'value': 18.75, 'unit': 'grams'}, 'add': 'middle', 'attribute': 'flavour'}, {'name': 'Columbus', 'amount': {'value': 18.75, 'unit': 'grams'}, 'add': 'middle', 'attribute': 'flavour'}, {'name': 'Centennial', 'amount': {'value': 50, 'unit': 'grams'}, 'add': 'end', 'attribute': 'flavour'}, {'name': 'Columbus', 'amount': {'value': 25, 'unit': 'grams'}, 'add': 'end', 'attribute': 'flavour'}, {'name': 'Amarillo', 'amount': {'value': 100, 'unit': 'grams'}, 'add': 'dry hop', 'attribute': 'aroma'}, {'name': 'Citra', 'amount': {'value': 100, 'unit': 'grams'}, 'add': 'dry hop', 'attribute': 'aroma'}, {'name': 'Simcoe', 'amount': {'value': 100, 'unit': 'grams'}, 'add': 'dry hop', 'attribute': 'aroma'}], 'yeast': 'Wyeast 1272 - American Ale II™'}","['Smoked salmon tostada', 'Schäufele', 'Rye apple cake']","The amount of rye shouldn’t cause a stuck mash, but if you find you are having problems the addition of rice hulls to your mash can help.",Sam Mason <samjbmason>
230,Black Hammer,Our Ruthless IPA With A Dark Malt Twist.,06/2016,"Jack Hammer has been single handedly ripping it up for quite some time. Now, the definitive bitter and twisted IPA, has spawned four Hammer Head off-springs. Black Hammer is the second of our hyped up hybrid IPAs. A black hearted beast, that takes no prisoners. American hops and dark malt combine to make mischief. Grapefruit and coffee collide in sensory overload – a wake-up call for other IPA’s. Molten waves of pithy grapefruit build and finally ebb to the roasty bitter onslaught. Stand  firm and wield the Black Hammer with care. Stare into the black abyss and succumb to the dark-side.",https://images.punkapi.com/v2/230.png,7.2,250.0,1010.0,1065.0,104.0,53.0,4.4,84.6,"{'value': 20, 'unit': 'litres'}","{'value': 25, 'unit': 'litres'}","{'mash_temp': [{'temp': {'value': 65, 'unit': 'celsius'}, 'duration': 75}], 'fermentation': {'temp': {'value': 21, 'unit': 'celsius'}}, 'twist': None}","{'malt': [{'name': 'Extra Pale', 'amount': {'value': 5.8, 'unit': 'kilograms'}}, {'name': 'Carafa Special Malt Type 3', 'amount': {'value': 0.8, 'unit': 'kilograms'}}], 'hops': [{'name': 'Centennial', 'amount': {'value': 25, 'unit': 'grams'}, 'add': 'start', 'attribute': 'bitter'}, {'name': 'Columbus Extract', 'amount': {'value': 30, 'unit': 'grams'}, 'add': 'start', 'attribute': 'bitter'}, {'name': 'Centennial', 'amount': {'value': 18.75, 'unit': 'grams'}, 'add': 'middle', 'attribute': 'flavour'}, {'name': 'Columbus', 'amount': {'value': 18.75, 'unit': 'grams'}, 'add': 'middle', 'attribute': 'flavour'}, {'name': 'Centennial', 'amount': {'value': 50, 'unit': 'grams'}, 'add': 'end', 'attribute': 'flavour'}, {'name': 'Columbus', 'amount': {'value': 25, 'unit': 'grams'}, 'add': 'end', 'attribute': 'flavour'}, {'name': 'Amarillo', 'amount': {'value': 100, 'unit': 'grams'}, 'add': 'dry hop', 'attribute': 'aroma'}, {'name': 'Citra', 'amount': {'value': 100, 'unit': 'grams'}, 'add': 'dry hop', 'attribute': 'aroma'}, {'name': 'Simcoe', 'amount': {'value': 100, 'unit': 'grams'}, 'add': 'dry hop', 'attribute': 'aroma'}], 'yeast': 'Wyeast 1272 - American Ale II™'}","['Buffalo wings with blue cheese dip', 'Spinach and feta tacos', 'Triple chocolate chip cookies']",You may have to leave this beer on dry hops for slightly longer than usual to let the flavours balance.,Sam Mason <samjbmason>
231,Ace Of Chinook,Single-Hopped Session IPA.,01/2016,"We love hops. We adore and worship their profile ability to transform beer. You could say that we have a terminal addiction. To celebrate this fetish we’re heroing our favourites in single hopped limited releases. No also starring, no extras, no compromise. The Hop is the Hero. A biscuity malty backbone builds to intense resinous pine with pithy citrus notes, culminating in a grapefruit hit and a long bitter finish. Our Ace in the hole, devastatingly singular, deliciously bitter. Serving up an Ace each and every time.",https://images.punkapi.com/v2/231.png,4.5,40.0,1011.0,1045.0,18.0,9.0,4.2,75.6,"{'value': 20, 'unit': 'litres'}","{'value': 25, 'unit': 'litres'}","{'mash_temp': [{'temp': {'value': 65, 'unit': 'celsius'}, 'duration': 75}], 'fermentation': {'temp': {'value': 19, 'unit': 'celsius'}}, 'twist': None}","{'malt': [{'name': 'Pale Ale', 'amount': {'value': 2.3, 'unit': 'kilograms'}}, {'name': 'Maris Otter', 'amount': {'value': 1.3, 'unit': 'kilograms'}}, {'name': 'Caramalt', 'amount': {'value': 0.5, 'unit': 'kilograms'}}], 'hops': [{'name': 'Chinook', 'amount': {'value': 3.75, 'unit': 'grams'}, 'add': 'start', 'attribute': 'bitter'}, {'name': 'Chinook', 'amount': {'value': 12.5, 'unit': 'grams'}, 'add': 'middle', 'attribute': 'flavour'}, {'name': 'Chinook', 'amount': {'value': 37.5, 'unit': 'grams'}, 'add': 'end', 'attribute': 'flavour'}, {'name': 'Chinook', 'amount': {'value': 187.5, 'unit': 'grams'}, 'add': 'dry hop', 'attribute': 'aroma'}], 'yeast': 'Wyeast 1056 - American Ale™'}","['Cheese covered tater tots', 'Chicago style hot dog', 'Beignet']",Use whole leaf hops for the dry hopping. They’re much easier to get out.,Matt Ball <GeordieMatt>
232,Ace Of Equinox,Single-Hopped Session IPA.,01/2016,"We love hops. We adore and worship their profile ability to transform beer. You could say that we have a terminal addiction. To celebrate this fetish we’re heroing our favourites in single hopped limited releases. No also starring, no extras, no compromise. The Hop is the Hero. A biscuity malty backbone builds to intense tropical fruit, with bitter resin notes, culminating with an explosive papya hit and a long bitter finish. Our Ace in the hole, devastatingly singular, deliciously bitter. Serving up an Ace each and every time.",https://images.punkapi.com/v2/232.png,4.5,40.0,1011.0,1045.0,18.0,9.0,4.2,75.6,"{'value': 20, 'unit': 'litres'}","{'value': 25, 'unit': 'litres'}","{'mash_temp': [{'temp': {'value': 65, 'unit': 'celsius'}, 'duration': 75}], 'fermentation': {'temp': {'value': 19, 'unit': 'celsius'}}, 'twist': None}","{'malt': [{'name': 'Pale Ale', 'amount': {'value': 2.3, 'unit': 'kilograms'}}, {'name': 'Maris Otter', 'amount': {'value': 1.3, 'unit': 'kilograms'}}, {'name': 'Caramalt', 'amount': {'value': 0.5, 'unit': 'kilograms'}}], 'hops': [{'name': 'Equinox', 'amount': {'value': 3.75, 'unit': 'grams'}, 'add': 'start', 'attribute': 'bitter'}, {'name': 'Equinox', 'amount': {'value': 10, 'unit': 'grams'}, 'add': 'middle', 'attribute': 'flavour'}, {'name': 'Equinox', 'amount': {'value': 37.5, 'unit': 'grams'}, 'add': 'end', 'attribute': 'flavour'}, {'name': 'Equinox', 'amount': {'value': 187.5, 'unit': 'grams'}, 'add': 'dry hop', 'attribute': 'aroma'}], 'yeast': 'Wyeast 1056 - American Ale™'}","['Chicken, mango and chili salad', 'Deep fried coconut prawns', 'Pineapple upside down cake']","If you are struggling with the malt hop balance, try upping the speciality malt a little bit until you hit your sweet spot.",Matt Ball <GeordieMatt>
233,Ace Of Citra,Single-Hopped Session IPA.,01/2016,"We love hops. We adore and worship their profile ability to transform beer. You could say that we have a terminal addiction. To celebrate this fetish we’re heroing our favourites in single hopped limited releases. No also starring, no extras, no compromise. The Hop is the Hero. A biscuity malty backbone layered with berry and resin, culminating with a lime zest hit and an explosive bitter citrus finish. Our Ace in the hole, devastatingly singular, deliciously bitter. Serving up an Ace each and every time.",https://images.punkapi.com/v2/233.png,4.5,40.0,1011.0,1045.0,18.0,9.0,4.2,75.6,"{'value': 20, 'unit': 'litres'}","{'value': 25, 'unit': 'litres'}","{'mash_temp': [{'temp': {'value': 65, 'unit': 'celsius'}, 'duration': 75}], 'fermentation': {'temp': {'value': 19, 'unit': 'celsius'}}, 'twist': None}","{'malt': [{'name': 'Pale Ale', 'amount': {'value': 2.3, 'unit': 'kilograms'}}, {'name': 'Maris Otter', 'amount': {'value': 1.3, 'unit': 'kilograms'}}, {'name': 'Caramalt', 'amount': {'value': 0.5, 'unit': 'kilograms'}}], 'hops': [{'name': 'Citra', 'amount': {'value': 3.75, 'unit': 'grams'}, 'add': 'start', 'attribute': 'bitter'}, {'name': 'Citra', 'amount': {'value': 12.5, 'unit': 'grams'}, 'add': 'middle', 'attribute': 'flavour'}, {'name': 'Citra', 'amount': {'value': 37.5, 'unit': 'grams'}, 'add': 'end', 'attribute': 'flavour'}, {'name': 'Citra', 'amount': {'value': 187.5, 'unit': 'grams'}, 'add': 'dry hop', 'attribute': 'aroma'}], 'yeast': 'Wyeast 1056 - American Ale™'}","['Courgette fries', 'Curried sea bass', 'Pistachio layer cake']",Let the wort sit for 30 minutes after flameout before cooling to get the most out of that last hop addition.,Matt Ball <GeordieMatt>
234,Neon Overlord,Mango And Chilli IPA,01/2016,"The Overlord of mango and chili IPA’s packs a fruity punch and then some. Pours a slightly hazy orange. A tropical fruit assault on the nose, with mango, pineapple, apricots and citrus. Hints of chili and sweet malts follow. Fruit dissipates to a chili kick, not hot but definitely there, followed by a long bitter finish. All hail to the hot tempered sweet toothed Lord.",https://images.punkapi.com/v2/234.png,7.6,70.0,1012.0,1067.0,20.0,10.0,4.4,82.0,"{'value': 20, 'unit': 'litres'}","{'value': 25, 'unit': 'litres'}","{'mash_temp': [{'temp': {'value': 65, 'unit': 'celsius'}, 'duration': 75}], 'fermentation': {'temp': {'value': 21, 'unit': 'celsius'}}, 'twist': '250g mango puree in FV'}","{'malt': [{'name': 'Extra Pale', 'amount': {'value': 5.3, 'unit': 'kilograms'}}, {'name': 'Cane Sugar', 'amount': {'value': 0.5, 'unit': 'kilograms'}}], 'hops': [{'name': 'Centennial', 'amount': {'value': 25, 'unit': 'grams'}, 'add': 'start', 'attribute': 'bitter'}, {'name': 'Centennial', 'amount': {'value': 13, 'unit': 'grams'}, 'add': 'middle', 'attribute': 'flavour'}, {'name': 'Columbus', 'amount': {'value': 13, 'unit': 'grams'}, 'add': 'middle', 'attribute': 'flavour'}, {'name': 'Mosaic', 'amount': {'value': 38, 'unit': 'grams'}, 'add': 'end', 'attribute': 'flavour'}, {'name': 'Citra', 'amount': {'value': 25, 'unit': 'grams'}, 'add': 'end', 'attribute': 'flavour'}, {'name': 'Habanero powder', 'amount': {'value': 6, 'unit': 'grams'}, 'add': 'end', 'attribute': 'flavour'}, {'name': 'Coriander seed', 'amount': {'value': 1, 'unit': 'grams'}, 'add': 'end', 'attribute': 'flavour'}], 'yeast': 'Wyeast 1272 - American Ale II™'}","['Baja fish tacos', 'Green mango salad', 'Salted butterscotch oatmeal cookies']",This fermentation is going to be wild. Use a blow off rather than an airlock to cope with the extra activity.,Matt Ball <GeordieMatt>
235,Mango And Chili Barley Wine,Spicy Chewy Sweet,2016,"A huge, chewy barley wine, loaded with bitterness and balanced with a sweet and spicy combo of mango and chili. A concept brew which was so well received, we tweaked it and it became Neon Overlord.",https://images.punkapi.com/v2/keg.png,12.0,,1015.0,1110.0,20.0,40.0,4.4,84.0,"{'value': 20, 'unit': 'litres'}","{'value': 25, 'unit': 'litres'}","{'mash_temp': [{'temp': {'value': 60, 'unit': 'celsius'}, 'duration': 30}, {'temp': {'value': 65, 'unit': 'celsius'}, 'duration': 20}, {'temp': {'value': 72, 'unit': 'celsius'}, 'duration': 15}, {'temp': {'value': 78, 'unit': 'celsius'}, 'duration': 10}], 'fermentation': {'temp': {'value': 21, 'unit': 'celsius'}}, 'twist': None}","{'malt': [{'name': 'Maris Otter', 'amount': {'value': 7, 'unit': 'kilograms'}}], 'hops': [{'name': 'Centennial', 'amount': {'value': 5, 'unit': 'grams'}, 'add': '90', 'attribute': 'bitter'}, {'name': 'Centennial', 'amount': {'value': 1, 'unit': 'grams'}, 'add': '15', 'attribute': 'flavour'}, {'name': 'Columbus', 'amount': {'value': 1, 'unit': 'grams'}, 'add': '15', 'attribute': 'flavour'}, {'name': 'Mosaic', 'amount': {'value': 3, 'unit': 'grams'}, 'add': 'whirlpool', 'attribute': 'aroma'}, {'name': 'Citra', 'amount': {'value': 2, 'unit': 'grams'}, 'add': 'whirlpool', 'attribute': 'aroma'}, {'name': 'Coriander Seed', 'amount': {'value': 4, 'unit': 'grams'}, 'add': 'whirlpool', 'attribute': 'aroma'}, {'name': 'Mango', 'amount': {'value': 500, 'unit': 'grams'}, 'add': 'secondary', 'attribute': 'flavour'}, {'name': '1 lemon drop chilli', 'amount': {'value': 1, 'unit': 'total'}, 'add': 'maturation', 'attribute': 'flavour'}], 'yeast': 'Wyeast 1272 - American Ale II™'}","['Vegetable Samosas', 'Thai Green Chicken Curry', 'Vanilla Panna Cotta']",Crack open the chili and add it in a muslin bag so you can take it out when the chilli heat suits you,Sam Mason <samjbmason>
236,Science IPA,India Pale Ale,2016,"A beer brewed specifically for the British Science Festival, held in Swansea.",https://images.punkapi.com/v2/keg.png,5.0,,1011.0,1050.0,24.0,47.0,4.4,77.0,"{'value': 20, 'unit': 'litres'}","{'value': 25, 'unit': 'litres'}","{'mash_temp': [{'temp': {'value': 60, 'unit': 'celsius'}, 'duration': 30}, {'temp': {'value': 65, 'unit': 'celsius'}, 'duration': 20}, {'temp': {'value': 72, 'unit': 'celsius'}, 'duration': 15}, {'temp': {'value': 78, 'unit': 'celsius'}, 'duration': 10}], 'fermentation': {'temp': {'value': 21, 'unit': 'celsius'}}, 'twist': None}","{'malt': [{'name': 'Maris Otter', 'amount': {'value': 4, 'unit': 'kilograms'}}, {'name': 'Dark Crystal', 'amount': {'value': 0.35, 'unit': 'kilograms'}}], 'hops': [{'name': 'Centennial', 'amount': {'value': 20, 'unit': 'grams'}, 'add': '60', 'attribute': 'bitter'}, {'name': 'Cascade', 'amount': {'value': 20, 'unit': 'grams'}, 'add': '30', 'attribute': 'flavour'}, {'name': 'Amarillo', 'amount': {'value': 40, 'unit': 'grams'}, 'add': 'whirlpool', 'attribute': 'aroma'}, {'name': 'Cascade', 'amount': {'value': 25, 'unit': 'grams'}, 'add': 'dry hop', 'attribute': 'aroma'}, {'name': 'Amarillo', 'amount': {'value': 25, 'unit': 'grams'}, 'add': 'dry hop', 'attribute': 'aroma'}], 'yeast': 'Wyeast 1272 - American Ale II™'}","['Chicken Katsu', 'Cheese and Ham Omelette', 'Pumpkin Pie']",This beer is all about the balance between the malty backbone of the beer and the fresh hop aroma. The fresher the hops the better.,Sam Mason <samjbmason>
237,Honey And Lemon Blitz,Honey & Lemon Infused Berliner Weisse.,2016,Honey & Lemon Blitz sees tart Berliner Weisse character multiplied by lemony acidity; light bready malt and a hint of warming honey hold this back from the brink of palate- destroying sourness.,https://images.punkapi.com/v2/keg.png,3.2,,1008.0,1039.0,8.0,4.0,3.2,75.0,"{'value': 20, 'unit': 'litres'}","{'value': 25, 'unit': 'litres'}","{'mash_temp': [{'temp': {'value': 60, 'unit': 'celsius'}, 'duration': 30}, {'temp': {'value': 65, 'unit': 'celsius'}, 'duration': 20}, {'temp': {'value': 72, 'unit': 'celsius'}, 'duration': 15}, {'temp': {'value': 78, 'unit': 'celsius'}, 'duration': 10}], 'fermentation': {'temp': {'value': 21, 'unit': 'celsius'}}, 'twist': 'Following souring steps outlined in Blitz Series recipes'}","{'malt': [{'name': 'Pilsner', 'amount': {'value': 1, 'unit': 'kilograms'}}, {'name': 'Wheat', 'amount': {'value': 1, 'unit': 'kilograms'}}, {'name': 'Munich', 'amount': {'value': 0.75, 'unit': 'kilograms'}}, {'name': 'Flaked Oats', 'amount': {'value': 0.2, 'unit': 'kilograms'}}, {'name': 'Smoked Malt', 'amount': {'value': 0.06, 'unit': 'kilograms'}}], 'hops': [{'name': 'Perle', 'amount': {'value': 6, 'unit': 'grams'}, 'add': '15', 'attribute': 'bitter'}, {'name': 'Lemon Peel', 'amount': {'value': 12, 'unit': 'grams'}, 'add': '15', 'attribute': 'aroma'}, {'name': 'Honey', 'amount': {'value': 10, 'unit': 'grams'}, 'add': '15', 'attribute': 'flavour'}], 'yeast': 'Wyeast 1272 - American Ale II™'}","['Herb-Crusted Baked Cod', 'Berry and Cream Meringue', 'Lemon Drizzle Cake']",Be careful not to over do the smoked malt as it's just a background flavour and you don’t want it to be prominent in the finished beer.,Sam Mason <samjbmason>
238,Kingpin,21st century lager.,2016,"A 4.7% German Pils with light, biscuit and toasty malt character, upon which is built a hop bitterness that provides complexity and a long, dry finish.",,4.7,40.0,1008.0,1044.0,14.0,7.0,4.2,79.0,"{'value': 20, 'unit': 'litres'}","{'value': 25, 'unit': 'litres'}","{'mash_temp': [{'temp': {'value': 65, 'unit': 'celsius'}, 'duration': 75}], 'fermentation': {'temp': {'value': 10, 'unit': 'celsius'}}, 'twist': None}","{'malt': [{'name': 'Pilsner', 'amount': {'value': 1.63, 'unit': 'kilograms'}}, {'name': 'Caramalt', 'amount': {'value': 0.16, 'unit': 'kilograms'}}, {'name': 'Munich', 'amount': {'value': 0.63, 'unit': 'kilograms'}}, {'name': 'Pale Ale', 'amount': {'value': 1.5, 'unit': 'kilograms'}}], 'hops': [{'name': 'Magnum', 'amount': {'value': 5, 'unit': 'grams'}, 'add': 'Start', 'attribute': 'Bitter'}, {'name': 'Perle', 'amount': {'value': 25, 'unit': 'grams'}, 'add': 'Middle', 'attribute': 'Flavour'}, {'name': 'Perle', 'amount': {'value': 12.5, 'unit': 'grams'}, 'add': 'End', 'attribute': 'Flavour'}], 'yeast': 'Wyeast 2007 - Pilsen Lager™'}","['Jamaican jerk chicken wings', 'Corn dogs', 'Strawberry ice cream sundae']",Keep an eye on your fermentation temperature to ensure you get the crisp notes that are the hallmark of a good pilsner.,John Jenkman <johnjenkman>
239,#Mashtag 2016,Sour cherry triple IPA.,2016,"We gave our customers the keys to the brewery and let them choose every aspect of this beer. Sour cherry combines with fruity hop character against a biscuit malt backbone with a hint of alcohol warmth, and an oaky undercurrent.",,10.5,100.0,1010.0,1090.0,15.0,8.0,4.4,89.04,"{'value': 20, 'unit': 'litres'}","{'value': 25, 'unit': 'litres'}","{'mash_temp': [{'temp': {'value': 65, 'unit': 'celsius'}, 'duration': 75}], 'fermentation': {'temp': {'value': 21, 'unit': 'celsius'}}, 'twist': '250g Sour Cherries, 5g Oak Chips'}","{'malt': [{'name': 'Pale Ale', 'amount': {'value': 6.3, 'unit': 'kilograms'}}, {'name': 'Dextrose', 'amount': {'value': 1, 'unit': 'kilograms'}}], 'hops': [{'name': 'Columbus', 'amount': {'value': 10, 'unit': 'grams'}, 'add': 'Start', 'attribute': 'Bitter'}, {'name': 'Simcoe', 'amount': {'value': 25, 'unit': 'grams'}, 'add': 'End', 'attribute': 'Flavour'}, {'name': 'Mosaic', 'amount': {'value': 25, 'unit': 'grams'}, 'add': 'End', 'attribute': 'Flavour'}, {'name': 'Citra', 'amount': {'value': 25, 'unit': 'grams'}, 'add': 'End', 'attribute': 'Flavour'}, {'name': 'Amarillo', 'amount': {'value': 25, 'unit': 'grams'}, 'add': 'End', 'attribute': 'Flavour'}, {'name': 'Simcoe', 'amount': {'value': 50, 'unit': 'grams'}, 'add': 'Dry Hop', 'attribute': 'Aroma'}, {'name': 'Mosaic', 'amount': {'value': 50, 'unit': 'grams'}, 'add': 'Dry Hop', 'attribute': 'Aroma'}, {'name': 'Citra', 'amount': {'value': 50, 'unit': 'grams'}, 'add': 'Dry Hop', 'attribute': 'Aroma'}, {'name': 'Amarillo', 'amount': {'value': 50, 'unit': 'grams'}, 'add': 'Dry Hop', 'attribute': 'Aroma'}], 'yeast': 'Wyeast 1272 - American Ale II™'}","['Confit duck with cherry sauce', 'Cajun ribs', 'Buttermilk waffles']",Rope in as many friends as you can to make it a truly democratic brew.,John Jenkman <johnjenkman>
240,Blitz Saison,Lemon & coriander Berliner Weisse,2016,Belgium meets Berlin – incredible saison character with a bright and vibrant sour edge.,https://images.punkapi.com/v2/keg.png,3.2,8.0,1007.0,1040.0,7.0,14.0,3.2,77.0,"{'value': 20, 'unit': 'litres'}","{'value': 25, 'unit': 'litres'}","{'mash_temp': [{'temp': {'value': 60, 'unit': 'celsius'}, 'duration': 30}, {'temp': {'value': 65, 'unit': 'celsius'}, 'duration': 20}, {'temp': {'value': 72, 'unit': 'celsius'}, 'duration': 15}, {'temp': {'value': 78, 'unit': 'celsius'}, 'duration': 10}], 'fermentation': {'temp': {'value': 21, 'unit': 'celsius'}}, 'twist': None}","{'malt': [{'name': 'Maris Otter', 'amount': {'value': 3, 'unit': 'kilograms'}}, {'name': 'Rye', 'amount': {'value': 0.25, 'unit': 'kilograms'}}, {'name': 'Flaked Oats', 'amount': {'value': 0.25, 'unit': 'kilograms'}}], 'hops': [{'name': 'Bramling Cross', 'amount': {'value': 7, 'unit': 'grams'}, 'add': '15', 'attribute': 'Bitter'}, {'name': 'Coriander', 'amount': {'value': 4, 'unit': 'grams'}, 'add': '15', 'attribute': 'Aroma'}, {'name': 'Peppercorn', 'amount': {'value': 2, 'unit': 'grams'}, 'add': '15', 'attribute': 'Flavour'}, {'name': 'Amarillo', 'amount': {'value': 15, 'unit': 'grams'}, 'add': 'Whirlpool', 'attribute': 'Aroma'}], 'yeast': 'Wyeast 3711 - French Saison™'}","['Taleggio and Spinach Tart', 'Chicken Adobo', 'Crème Caramel']",This will ferment out very dry due to the yeast.,John Jenkman <johnjenkman>
241,Hello My Name Is Ingrid 2016,Cloudberry Double IPA,2016,"We asked the public to tell us the one beer we should brew again, from our entire back catalogue. They chose well. Cloudberries team up with pan-global hops for an all out fruit riot against a caramel malt base.",,8.2,70.0,1013.0,1076.0,30.0,15.2,5.2,83.3,"{'value': 20, 'unit': 'litres'}","{'value': 25, 'unit': 'litres'}","{'mash_temp': [{'temp': {'value': 65, 'unit': 'celsius'}, 'duration': 75}], 'fermentation': {'temp': {'value': 21, 'unit': 'celsius'}}, 'twist': None}","{'malt': [{'name': 'Extra Pale', 'amount': {'value': 4.9, 'unit': 'kilograms'}}, {'name': 'Caramalt', 'amount': {'value': 0.7, 'unit': 'kilograms'}}], 'hops': [{'name': 'Columbus', 'amount': {'value': 8, 'unit': 'grams'}, 'add': 'Start', 'attribute': 'Bitter'}, {'name': 'Centennial', 'amount': {'value': 8, 'unit': 'grams'}, 'add': 'Start', 'attribute': 'Bitter'}, {'name': 'Columbus', 'amount': {'value': 5, 'unit': 'grams'}, 'add': 'Middle', 'attribute': 'Flavour'}, {'name': 'Centennial', 'amount': {'value': 5, 'unit': 'grams'}, 'add': 'Middle', 'attribute': 'Flavour'}, {'name': 'Enigma', 'amount': {'value': 5, 'unit': 'grams'}, 'add': 'Middle', 'attribute': 'Flavour'}, {'name': 'Bramling Cross', 'amount': {'value': 6, 'unit': 'grams'}, 'add': 'Middle', 'attribute': 'Flavour'}, {'name': 'Columbus', 'amount': {'value': 6, 'unit': 'grams'}, 'add': 'End', 'attribute': 'Flavour'}, {'name': 'Centennial', 'amount': {'value': 6, 'unit': 'grams'}, 'add': 'End', 'attribute': 'Flavour'}, {'name': 'Enigma', 'amount': {'value': 5, 'unit': 'grams'}, 'add': 'End', 'attribute': 'Flavour'}, {'name': 'Bramling Cross', 'amount': {'value': 6, 'unit': 'grams'}, 'add': 'End', 'attribute': 'Flavour'}, {'name': 'Citra', 'amount': {'value': 30, 'unit': 'grams'}, 'add': 'Dry Hop', 'attribute': 'Aroma'}, {'name': 'Enigma', 'amount': {'value': 60, 'unit': 'grams'}, 'add': 'Dry Hop', 'attribute': 'Aroma'}, {'name': 'Bramling Cross', 'amount': {'value': 30, 'unit': 'grams'}, 'add': 'Dry Hop', 'attribute': 'Aroma'}], 'yeast': 'Wyeast 1272 - American Ale II™'}","['Tempura Prawns', 'Soy-Glazed Chicken Thighs', 'Raspberry Soufflé']",Add the cloudberries to your beer when racking the beer after primary fermentation. Grind them into a paste to allow maximum flavour extraction.,John Jenkman <johnjenkman>
