id,name,tagline,first_brewed,description,image_url,abv,ibu,target_fg,target_og,ebc,srm,ph,attenuation_level,volume,boil_volume,method,ingredients,food_pairing,brewers_tips,contributed_by
164,Ella - IPA Is Dead,Single Hop India Pale Ale.,03/2015,"2015 IPA is Dead Series. Supremely floral, this hugely under-rated hop is related to Galaxy and was first cultivated in the Australian state of Victoria. Initially given the same name as a certain Eurolager, their lawyers got involved and the St- prefix was dropped. Ella displays subtle notes of spice, but is fundamentally a truly floral bouquet, redolent of the Southern Hemisphere.",https://images.punkapi.com/v2/164.png,7.2,100.0,1010.0,1064.0,12.0,6.0,4.4,84.0,"{'value': 20, 'unit': 'litres'}","{'value': 25, 'unit': 'litres'}","{'mash_temp': [{'temp': {'value': 65, 'unit': 'celsius'}, 'duration': 75}], 'fermentation': {'temp': {'value': 19, 'unit': 'celsius'}}, 'twist': None}","{'malt': [{'name': 'Extra Pale', 'amount': {'value': 6.39, 'unit': 'kilograms'}}], 'hops': [{'name': 'Ella', 'amount': {'value': 2.5, 'unit': 'grams'}, 'add': 'start', 'attribute': 'bitter'}, {'name': 'Ella', 'amount': {'value': 41.5, 'unit': 'grams'}, 'add': 'middle', 'attribute': 'flavour'}, {'name': 'Ella', 'amount': {'value': 41.5, 'unit': 'grams'}, 'add': 'end', 'attribute': 'flavour'}], 'yeast': 'Wyeast 1056 - American Ale™'}","['Cheddar cheese toastie on dark rye', 'Lamb samosas with chilli dipping sauce', 'Cheesecake']","These beers need to hit FG to really pop. If you're fermentation is struggling, whip up a starter and re-pitch to get some viable yeast in there to finish the job",Sam Mason <samjbmason>
165,Barley Wine - Russian Doll,Double India Pale Ale.,06/2014,"Russian Doll was an experimental set of brews showcasing the effects of varying the amount and ratio of malts in the grist. The barley wine had rich, chewy dark fruit aromas balanced with a spike of zesty hops. Toffee, apricot jam and grapefruit pith, crammed into the head of our little Russian Doll family.",https://images.punkapi.com/v2/165.png,10.0,80.0,1020.0,1097.0,65.0,32.5,4.4,79.4,"{'value': 20, 'unit': 'litres'}","{'value': 25, 'unit': 'litres'}","{'mash_temp': [{'temp': {'value': 65, 'unit': 'celsius'}, 'duration': 90}], 'fermentation': {'temp': {'value': 21, 'unit': 'celsius'}}, 'twist': None}","{'malt': [{'name': 'Extra Pale', 'amount': {'value': 9.5, 'unit': 'kilograms'}}, {'name': 'Caramalt', 'amount': {'value': 1, 'unit': 'kilograms'}}, {'name': 'Dark Crystal', 'amount': {'value': 0.75, 'unit': 'kilograms'}}], 'hops': [{'name': 'Centennial', 'amount': {'value': 75, 'unit': 'grams'}, 'add': 'start', 'attribute': 'bitter'}, {'name': 'Centennial', 'amount': {'value': 25, 'unit': 'grams'}, 'add': 'middle', 'attribute': 'flavour'}, {'name': 'Simcoe', 'amount': {'value': 25, 'unit': 'grams'}, 'add': 'middle', 'attribute': 'flavour'}, {'name': 'Simcoe', 'amount': {'value': 25, 'unit': 'grams'}, 'add': 'end', 'attribute': 'flavour'}, {'name': 'Citra', 'amount': {'value': 25, 'unit': 'grams'}, 'add': 'end', 'attribute': 'flavour'}, {'name': 'Simcoe', 'amount': {'value': 200, 'unit': 'grams'}, 'add': 'dry hop', 'attribute': 'aroma'}, {'name': 'Citra', 'amount': {'value': 150, 'unit': 'grams'}, 'add': 'dry hop', 'attribute': 'aroma'}, {'name': 'Centennial', 'amount': {'value': 200, 'unit': 'grams'}, 'add': 'dry hop', 'attribute': 'aroma'}], 'yeast': 'Wyeast 1272 - American Ale II™'}","['Stilton tart', 'Caramelised onion and ham foccacia', 'Dark fruit crumble']",Age the beer in bottle for a few months at cellar temperature to allow the hot alcohol characteristic to diminish.,Sam Mason <samjbmason>
166,Vagabond Pale ALe - Prototype Challenge,Gluten Free Beer. Toffee. Piney. Fruitcake.,11/2014,"A foundation of caramel malt is buttressed by a raucously resinous bitterness, as the rioting backdrop of citrus and tropical fruit flow in waves from those twin titans of the US – Centennial and Amarillo. And it also happens to be gluten free.",https://images.punkapi.com/v2/166.png,4.5,55.0,1011.0,1045.0,20.0,10.0,4.2,73.9,"{'value': 20, 'unit': 'litres'}","{'value': 25, 'unit': 'litres'}","{'mash_temp': [{'temp': {'value': 65, 'unit': 'celsius'}, 'duration': 75}], 'fermentation': {'temp': {'value': 19, 'unit': 'celsius'}}, 'twist': None}","{'malt': [{'name': 'Pale Ale', 'amount': {'value': 3.38, 'unit': 'kilograms'}}, {'name': 'Caramalt', 'amount': {'value': 0.5, 'unit': 'kilograms'}}, {'name': 'Crystal 150', 'amount': {'value': 0.19, 'unit': 'kilograms'}}], 'hops': [{'name': 'Centennial', 'amount': {'value': 2.5, 'unit': 'grams'}, 'add': 'start', 'attribute': 'bitter'}, {'name': 'Amarillo', 'amount': {'value': 2.5, 'unit': 'grams'}, 'add': 'start', 'attribute': 'bitter'}, {'name': 'Centennial', 'amount': {'value': 10, 'unit': 'grams'}, 'add': 'start', 'attribute': 'bitter'}, {'name': 'Amarillo', 'amount': {'value': 10, 'unit': 'grams'}, 'add': 'start', 'attribute': 'bitter'}, {'name': 'Amarillo', 'amount': {'value': 12.5, 'unit': 'grams'}, 'add': 'end', 'attribute': 'flavour'}, {'name': 'Centennial', 'amount': {'value': 100, 'unit': 'grams'}, 'add': 'dry hop', 'attribute': 'aroma'}, {'name': 'Amarillo', 'amount': {'value': 87.5, 'unit': 'grams'}, 'add': 'dry hop', 'attribute': 'aroma'}], 'yeast': 'Wyeast 1056 - American Ale™'}","['Chinese chicken salad', 'Lemon grilled halibut', 'Apple crumble']",Add .75g (0.026oz) of Brewers Clarex to your fermentation vessel during casting.,Sam Mason <samjbmason>
167,Libertine Black Ale,The New Black. Roasty. Hoppy. Fruity.,03/2012,"A dark hop bomb combining the malt-forward indulgences of a stout with the insatiable hopload of an IPA. Rich spiced blackcurrant and caramel up front, with a sharp bitter finish following behind, bringing grapefruit and resin with it. Dry, bitter and intense; this is an IPA first and foremost, given a dark malt makeover. Originally brewed as a Simcoe only single hop IPA, we've experimented with adding a little Cascade and Mosaic for extra depth.",https://images.punkapi.com/v2/167.png,7.2,50.0,1013.0,1068.0,150.0,76.0,4.4,78.6,"{'value': 20, 'unit': 'litres'}","{'value': 25, 'unit': 'litres'}","{'mash_temp': [{'temp': {'value': 65, 'unit': 'celsius'}, 'duration': 75}], 'fermentation': {'temp': {'value': 19, 'unit': 'celsius'}}, 'twist': None}","{'malt': [{'name': 'Extra Pale', 'amount': {'value': 5.3, 'unit': 'kilograms'}}, {'name': 'Caramalt', 'amount': {'value': 0.25, 'unit': 'kilograms'}}, {'name': 'Crystal 150', 'amount': {'value': 0.19, 'unit': 'kilograms'}}, {'name': 'Carafa Special Malt Type 1', 'amount': {'value': 0.13, 'unit': 'kilograms'}}, {'name': 'Carafa Special Malt Type 3', 'amount': {'value': 0.19, 'unit': 'kilograms'}}], 'hops': [{'name': 'Simcoe', 'amount': {'value': 18.75, 'unit': 'grams'}, 'add': 'start', 'attribute': 'bitter'}, {'name': 'Simcoe', 'amount': {'value': 18.75, 'unit': 'grams'}, 'add': 'middle', 'attribute': 'bitter'}, {'name': 'Simcoe', 'amount': {'value': 37.5, 'unit': 'grams'}, 'add': 'end', 'attribute': 'flavour'}, {'name': 'Simcoe', 'amount': {'value': 175, 'unit': 'grams'}, 'add': 'dry hop', 'attribute': 'aroma'}, {'name': 'Cascade', 'amount': {'value': 37.5, 'unit': 'grams'}, 'add': 'dry hop', 'attribute': 'aroma'}, {'name': 'Mosaic', 'amount': {'value': 37.5, 'unit': 'grams'}, 'add': 'dry hop', 'attribute': 'aroma'}], 'yeast': 'Wyeast 1272 - American Ale II™'}","['Grilled king prawns with a chilli lime sauce', 'Blue cheese burger', 'Flourless chocolate ginger cake']","The goal here is to make a black beer that tastes like an IPA. Don't overload the black or roasted malts to try and achieve the correct colour. Too much roasted malts will suppress far too much of that beautiful citrus and tropical flavour from the Simcoe. It may be hard to get hold of Carafa, but it will allow you to get a great colour, without all of the characteristic roasty astringent flavours.",Sam Mason <samjbmason>
168,Jack Hammer,Ruthless India Pale Ale. Hoppy. Bitter. Hoppy.,06/2012,"Hopped beyond the point at which IBUs are measurable, only the most hardened palate will get beyond Jack Hammer's intensely resinous pithy bitterness and to the grapefruit, orange zest and dry biscuity malt beyond. You could brew this with less hops, but really, why would you bother?",https://images.punkapi.com/v2/168.png,7.2,250.0,1010.0,1065.0,15.0,7.5,4.4,84.6,"{'value': 20, 'unit': 'litres'}","{'value': 25, 'unit': 'litres'}","{'mash_temp': [{'temp': {'value': 65, 'unit': 'celsius'}, 'duration': 75}], 'fermentation': {'temp': {'value': 21, 'unit': 'celsius'}}, 'twist': None}","{'malt': [{'name': 'Extra Pale', 'amount': {'value': 5.8, 'unit': 'kilograms'}}], 'hops': [{'name': 'Centennial', 'amount': {'value': 25, 'unit': 'grams'}, 'add': 'start', 'attribute': 'bitter'}, {'name': 'Columbus Extract', 'amount': {'value': 30, 'unit': 'grams'}, 'add': 'start', 'attribute': 'bitter'}, {'name': 'Centennial', 'amount': {'value': 18.75, 'unit': 'grams'}, 'add': 'middle', 'attribute': 'flavour'}, {'name': 'Columbus', 'amount': {'value': 18.75, 'unit': 'grams'}, 'add': 'middle', 'attribute': 'flavour'}, {'name': 'Centennial', 'amount': {'value': 50, 'unit': 'grams'}, 'add': 'end', 'attribute': 'flavour'}, {'name': 'Columbus', 'amount': {'value': 25, 'unit': 'grams'}, 'add': 'end', 'attribute': 'flavour'}, {'name': 'Amarillo', 'amount': {'value': 100, 'unit': 'grams'}, 'add': 'dry hop', 'attribute': 'aroma'}, {'name': 'Citra', 'amount': {'value': 100, 'unit': 'grams'}, 'add': 'dry hop', 'attribute': 'aroma'}, {'name': 'Simcoe', 'amount': {'value': 100, 'unit': 'grams'}, 'add': 'dry hop', 'attribute': 'aroma'}], 'yeast': 'Wyeast 1272 - American Ale II™'}","['Phall Curry', 'Pork burrito with a habanero and mango chilli salsa', 'Ginger and grapefruit poundcake']","Be aware that this is probably the hoppiest beer you will ever make. Make sure you use fresh hops, for a massive fresh grapefruit hit. Have everything else in your store cupboard, and buy your hops last, as close to brew day as possible!",Sam Mason <samjbmason>
169,AB:19,A Blend of Two Barrel-aged Imperial Saisons.,06/2012,"One of the most complex beers we’ve ever attempted. A blend of two barrel-aged Imperial Saisons – one black, one red – which has in turn then been aged in rum barrels, it is an enormous, intricate beer. A baseline of warm, smoky raisin and plum, followed by punchy flavour elements coming to the fore – coconut, mint and blackcurrant. There’s a long undercurrent of treacle toffee, before the finish darkens to liquorice, star anise amidst a touch of honey sweetness.",https://images.punkapi.com/v2/169.png,13.1,,,,,,,,"{'value': 20, 'unit': 'litres'}","{'value': 25, 'unit': 'litres'}","{'mash_temp': [{'temp': {'value': None, 'unit': 'celsius'}, 'duration': None}], 'fermentation': {'temp': {'value': None, 'unit': 'celsius'}}, 'twist': 'This beer is an odd one in our collection as it is a blend of two recipes that feature elsewhere. These recipes are #123 Everyday Anarchy and #124 Black Jacques. Both Imperial Saisons spent a little under a year in white and red wine barrels respectively. However, while the pair were being tasted to determine their readiness to be released, a fun game of blending turned into a light bulb moment. The beers were blended and laid down once more in our barrel cellar, this time being infused with the heady note of rum. We were so excited about this mystical blend that we ended up using up all the beer that had been lovingly aged. It would have been a travesty for these beers to go unrecognised as the unique individuals they were, so we brewed them again in 2013 to be released as had always been intended. Age the individual beers separately before blending and ageing further on oak chips soaked in rum.'}","{'malt': [], 'hops': [], 'yeast': None}","['Game terrine', 'Spiced fruit cake', 'Chocolate, cherry and hazelnut mousse']",It can be difficult to get the perfect balance between both beers. Set up several small blends of varying percentages to determine which you prefer.,Sam Mason <samjbmason>
170,Bashah (w/ Stone Brewing Co),Black Belgian Double IPA.,08/2009,"Brewed when our good friends from Stone visited in 2009. Black As Sin, Hoppy As Hell - no other beer name has quite hit the nail so squarely on the head. Dark roasted malt makes a beautiful canvas for the savage hop bitterness, pine needles and orange zest.",https://images.punkapi.com/v2/170.png,9.7,100.0,1015.0,1088.0,30.0,15.3,4.4,83.0,"{'value': 20, 'unit': 'litres'}","{'value': 25, 'unit': 'litres'}","{'mash_temp': [{'temp': {'value': 65, 'unit': 'celsius'}, 'duration': 175}], 'fermentation': {'temp': {'value': 19, 'unit': 'celsius'}}, 'twist': None}","{'malt': [{'name': 'Extra Pale', 'amount': {'value': 8.13, 'unit': 'kilograms'}}, {'name': 'Chocolate', 'amount': {'value': 0.16, 'unit': 'kilograms'}}, {'name': 'Carafa Special Malt Type 3', 'amount': {'value': 0.48, 'unit': 'kilograms'}}], 'hops': [{'name': 'Hercules', 'amount': {'value': 31.3, 'unit': 'grams'}, 'add': 'start', 'attribute': 'bitter'}, {'name': 'Magnum', 'amount': {'value': 12.5, 'unit': 'grams'}, 'add': 'start', 'attribute': 'bitter'}, {'name': 'Magnum', 'amount': {'value': 12.5, 'unit': 'grams'}, 'add': 'start', 'attribute': 'bitter'}, {'name': 'Hercules', 'amount': {'value': 12.5, 'unit': 'grams'}, 'add': 'end', 'attribute': 'flavour'}, {'name': 'Centennial', 'amount': {'value': 25, 'unit': 'grams'}, 'add': 'end', 'attribute': 'flavour'}, {'name': 'Amarillo', 'amount': {'value': 25, 'unit': 'grams'}, 'add': 'end', 'attribute': 'flavour'}], 'yeast': 'Wyeast 3522 - Belgian Ardennes™'}","['Chocolate crème brûlée with raspberries', 'Thyme, rosemary and black pepper rubbed roast beef served with fried green beans', 'Angus beef cheeseburger']","We also produced two separate barrel- aged versions of this beer; Bashah 2009 Highland Park and Black Raspberry Reserve, and Bashah 2009 Imperial and Tayberry Reserve were two barrel aged versions of the beer. Try ageing this beer on oak or with fruit to make your own reserve.",Sam Mason <samjbmason>
171,Challenger,Single Hop India Pale Ale – 2012.,02/2012,"Challenger is known for its herbal and fruity characteristics. When used alone in a beer like IPA is Dead, Challenger brings light woodsy notes, floral hints, and delicate green tea, alongside more recognisable citrus notes. As a dual-purpose hop, it also yields great bittering potential, which is ideal in a dry bitter IPA.",https://images.punkapi.com/v2/171.png,6.7,67.0,1013.0,1064.0,19.0,9.5,4.4,79.7,"{'value': 20, 'unit': 'litres'}","{'value': 25, 'unit': 'litres'}","{'mash_temp': [{'temp': {'value': 68, 'unit': 'celsius'}, 'duration': None}], 'fermentation': {'temp': {'value': 19, 'unit': 'celsius'}}, 'twist': None}","{'malt': [{'name': 'Extra Pale - Spring Blend', 'amount': {'value': 5.87, 'unit': 'kilograms'}}, {'name': 'Caramalt', 'amount': {'value': 0.37, 'unit': 'kilograms'}}, {'name': 'Crystal 150', 'amount': {'value': 0.19, 'unit': 'kilograms'}}], 'hops': [{'name': 'Challenger', 'amount': {'value': 85, 'unit': 'grams'}, 'add': 'start', 'attribute': 'bitter'}, {'name': 'Challenger', 'amount': {'value': 100, 'unit': 'grams'}, 'add': 'end', 'attribute': 'flavour'}, {'name': 'Challenger', 'amount': {'value': 250, 'unit': 'grams'}, 'add': 'dry hop', 'attribute': 'aroma'}], 'yeast': 'Wyeast 1056 - American Ale™'}","['Caramelized onion and steak pie', 'Chicken Khua Kling (dry Thai curry)', 'Lemon drizzle cake']","Challenger hops come from English hops farms - try getting hold of some fresh, undried hops and make a ""wet hop"" beer.",Sam Mason <samjbmason>
172,Single Hop Enigma IPA - B-Sides,Enigma Hopped IPA.,01/2016,"A cheeky play with a new hop on the pilot kit. Expect notes of redcurrant, melon and citrus. An intriguing possibility for the future.",https://images.punkapi.com/v2/keg.png,5.0,50.0,1011.0,1050.0,10.0,5.0,4.4,78.0,"{'value': 20, 'unit': 'litres'}","{'value': 25, 'unit': 'litres'}","{'mash_temp': [{'temp': {'value': 60, 'unit': 'celsius'}, 'duration': 10}, {'temp': {'value': 65, 'unit': 'celsius'}, 'duration': 30}, {'temp': {'value': 72, 'unit': 'celsius'}, 'duration': 10}, {'temp': {'value': 78, 'unit': 'celsius'}, 'duration': 5}], 'fermentation': {'temp': {'value': 19, 'unit': 'celsius'}}, 'twist': None}","{'malt': [{'name': 'Propino Pale Malt', 'amount': {'value': 4.1, 'unit': 'kilograms'}}], 'hops': [{'name': 'Enigma', 'amount': {'value': 2.5, 'unit': 'grams'}, 'add': 'start', 'attribute': 'bitter'}, {'name': 'Enigma', 'amount': {'value': 10, 'unit': 'grams'}, 'add': 'middle', 'attribute': 'flavour'}, {'name': 'Enigma', 'amount': {'value': 37.5, 'unit': 'grams'}, 'add': 'end', 'attribute': 'flavour'}], 'yeast': 'Wyeast 1056 - American Ale™ & Wyeast 1272 - American Ale II™'}","['Jalapeño poppers with blue cheese dip', 'T-bone steak with fried onions', 'Carrot cake with cream cheese frosting']",Enigma has a very high alpha acid so be careful not to over do the bittering hops.,Sam Mason <samjbmason>
173,Chinook - IPA Is Dead,Single Hop India Pale Ale.,03/2015,"2015 IPA is Dead series. Often used as a combination hop for American Pale Ales and IPAs, Chinook can really shine when left to front a beer all on its own. The main reason for this is that it’s thunderously piney, with a fistful of spice kicked up in your face as you lie on the beach. A true heavyweight of the brewing industry.",https://images.punkapi.com/v2/173.png,7.2,100.0,1010.0,1064.0,12.0,6.0,4.4,84.0,"{'value': 20, 'unit': 'litres'}","{'value': 25, 'unit': 'litres'}","{'mash_temp': [{'temp': {'value': 65, 'unit': 'celsius'}, 'duration': 75}], 'fermentation': {'temp': {'value': 19, 'unit': 'celsius'}}, 'twist': None}","{'malt': [{'name': 'Extra Pale', 'amount': {'value': 6.39, 'unit': 'kilograms'}}], 'hops': [{'name': 'Chinook', 'amount': {'value': 13.5, 'unit': 'grams'}, 'add': 'start', 'attribute': 'bitter'}, {'name': 'Chinook', 'amount': {'value': 41.5, 'unit': 'grams'}, 'add': 'middle', 'attribute': 'flavour'}, {'name': 'Chinook', 'amount': {'value': 41.5, 'unit': 'grams'}, 'add': 'end', 'attribute': 'flavour'}], 'yeast': 'Wyeast 1056 - American Ale™'}","['Chicken fajita spiced monteray jack quesadillas', 'Chilli lime and coriander marinated king prawn cocktail', 'Margarita key lime pie']",Chinook is a hop that can really shine on its own so don't be shy and really throw it at this IPA,Sam Mason <samjbmason>
174,Konnichiwa Kitsune,Hello My Name Is Yuzu.,10/2014,"Named in a slight deviation from our Hello My Name Is series, Konnichiwa Kitsune is a Japanese- inspired, yuzu-infused Imperial IPA, brewed with Amarillo, Cascade and Citra. These punchy new world hops bring orange, grapefruit and lime to back up the yuzu aroma and flavour. Big mandarin notes, balanced against a caramel malt biscuity base.",https://images.punkapi.com/v2/174.png,4.4,70.0,1012.0,1045.0,30.0,15.0,4.4,82.9,"{'value': 20, 'unit': 'litres'}","{'value': 25, 'unit': 'litres'}","{'mash_temp': [{'temp': {'value': 65, 'unit': 'celsius'}, 'duration': 75}], 'fermentation': {'temp': {'value': 20, 'unit': 'celsius'}}, 'twist': 'Yuzu juice: 250g at FV'}","{'malt': [{'name': 'Extra Pale', 'amount': {'value': 6.13, 'unit': 'kilograms'}}, {'name': 'Caramalt', 'amount': {'value': 0.86, 'unit': 'kilograms'}}], 'hops': [{'name': 'Amarillo', 'amount': {'value': 12.5, 'unit': 'grams'}, 'add': 'start', 'attribute': 'bitter'}, {'name': 'Citra', 'amount': {'value': 6, 'unit': 'grams'}, 'add': 'start', 'attribute': 'bitter'}, {'name': 'Cascade', 'amount': {'value': 12.5, 'unit': 'grams'}, 'add': 'start', 'attribute': 'bitter'}, {'name': 'Amarillo', 'amount': {'value': 6, 'unit': 'grams'}, 'add': 'middle', 'attribute': 'flavour'}, {'name': 'Citra', 'amount': {'value': 6, 'unit': 'grams'}, 'add': 'middle', 'attribute': 'flavour'}, {'name': 'Cascade', 'amount': {'value': 12.5, 'unit': 'grams'}, 'add': 'middle', 'attribute': 'flavour'}, {'name': 'Amarillo', 'amount': {'value': 18.5, 'unit': 'grams'}, 'add': 'end', 'attribute': 'flavoour'}, {'name': 'Citra', 'amount': {'value': 12.5, 'unit': 'grams'}, 'add': 'end', 'attribute': 'flavouor'}, {'name': 'Cascade', 'amount': {'value': 12.5, 'unit': 'grams'}, 'add': 'end', 'attribute': 'flavour'}, {'name': 'Citra', 'amount': {'value': 100, 'unit': 'grams'}, 'add': 'dry hop', 'attribute': 'aroma'}, {'name': 'Amarillo', 'amount': {'value': 137.5, 'unit': 'grams'}, 'add': 'dry hop', 'attribute': 'aroma'}, {'name': 'Cascade', 'amount': {'value': 87.5, 'unit': 'grams'}, 'add': 'dry hop', 'attribute': 'aroma'}], 'yeast': 'Wyeast 1272 - American Ale II™'}","['Fresh seared tuna and rocket salad', 'Lemon meringue pie', 'Baked chicken with yuzu reduction']","Squeeze the fresh yuzu juice directly into the beer after primary fermentation is complete. Putting it in the hot wort may seem like better practice, but the juice will cook and some of the fresh citrus character will be lost.",Sam Mason <samjbmason>
175,San Diego Scotch Ale (w/Ballast Point),Imperial Scotch Ale With Rum & Raisin.,07/2012,"Whisky cask aged with raisins soaked in rum. Warm, chocolatey and boozy with refreshing resinous bitterness and a lingering toasty biscuit background from the malt. Toasted oak comes courtesy of the barrels and spicy, sweet, dark fruit flavours from the rum soaked raisins.",https://images.punkapi.com/v2/175.png,9.0,70.0,1018.0,1090.0,190.0,95.0,4.4,80.0,"{'value': 20, 'unit': 'litres'}","{'value': 25, 'unit': 'litres'}","{'mash_temp': [{'temp': {'value': 65, 'unit': 'celsius'}, 'duration': 50}], 'fermentation': {'temp': {'value': 21, 'unit': 'celsius'}}, 'twist': 'Age in whisky casks with rum soaked raisins'}","{'malt': [{'name': 'Pale Ale - Tipple', 'amount': {'value': 8.32, 'unit': 'kilograms'}}, {'name': 'Munich', 'amount': {'value': 1.79, 'unit': 'kilograms'}}, {'name': 'Crystal', 'amount': {'value': 1.19, 'unit': 'kilograms'}}, {'name': 'Dark Crystal', 'amount': {'value': 0.59, 'unit': 'kilograms'}}, {'name': 'Carafa Special Malt Type 1', 'amount': {'value': 0.12, 'unit': 'kilograms'}}], 'hops': [{'name': 'First Gold', 'amount': {'value': 125, 'unit': 'grams'}, 'add': 'start', 'attribute': 'bitter'}, {'name': 'Challenger', 'amount': {'value': 62.5, 'unit': 'grams'}, 'add': 'end', 'attribute': 'flavour'}, {'name': 'Amarillo', 'amount': {'value': 125, 'unit': 'grams'}, 'add': 'end', 'attribute': 'flavour'}], 'yeast': 'Wyeast 1272 - American Ale II™'}","['Venison stroganoff', 'Chilli dog', 'Toffee chocolate cheesecake']","Soak oak chips in rum, then steep in the beer for the rum cash finish.",Sam Mason <samjbmason>
176,Old World India Pale Ale,English India Pale Ale.,10/2011,"This recreated the epic IPAs that were sent on monumental ocean voyages from England to India by sea in the 1800s. Medium bodied with a complex malt profile, backed up with intense bitterness and a woodsy, earthy rich English hop character.",https://images.punkapi.com/v2/176.png,7.5,80.0,1012.0,1069.0,50.0,25.0,4.4,82.6,"{'value': 20, 'unit': 'litres'}","{'value': 25, 'unit': 'litres'}","{'mash_temp': [{'temp': {'value': 65, 'unit': 'celsius'}, 'duration': None}], 'fermentation': {'temp': {'value': 22, 'unit': 'celsius'}}, 'twist': None}","{'malt': [{'name': 'Maris Otter Extra Pale', 'amount': {'value': 6.25, 'unit': 'kilograms'}}, {'name': 'Amber', 'amount': {'value': 0.25, 'unit': 'kilograms'}}, {'name': 'Crystal 150', 'amount': {'value': 0.25, 'unit': 'kilograms'}}], 'hops': [{'name': 'Bramling Cross', 'amount': {'value': 62.5, 'unit': 'grams'}, 'add': 'start', 'attribute': 'bitter'}, {'name': 'First Gold', 'amount': {'value': 50, 'unit': 'grams'}, 'add': 'end', 'attribute': 'flavour'}, {'name': 'Bramling Cross', 'amount': {'value': 50, 'unit': 'grams'}, 'add': 'end', 'attribute': 'flavour'}], 'yeast': 'Wyeast 1272 - American Ale II™'}","['Honey glazed ham with spicy roasted carrots', 'Mature cheddar with spicy chutney', 'Peach cobbler']","In beers like this with a hefty malt bill, it pays to check a spoonful of the mash with some iodine solution. This will indicate if the mash has converted all of the starch into fermentable sugars. If the colour is very dark, just extend the mash rest by 10 mins and check again.",Sam Mason <samjbmason>
